priority_tier,rank,canonical_name,family,n_works,max_score,total_score,n_title_matches,n_context_matches,best_title,best_doi,best_openalex_id,best_match_evidence,review_status
A,210,Succisella microcephala,Caprifoliaceae,1,25,25,1,1,Visual attraction cues associated with tachinid pollination: insights from colour variation in Succisella microcephala (Caprifoliaceae),10.26786/1920-7603(2025)892,https://openalex.org/W4417421528,"challenging due to their functional heterogeneity. Recent studies have therefore proposed narrowing dipteran pollination into more precise syndromes. In this context, preliminary field observations of flower visitors to Succisella microcephala suggest a potential case of specialisation towards tachinid flies. Despite its generalist-like floral morphology, S. microcephala exhibits geographic variation in corolla colour and contrasting pigmentation between the",unreviewed
A,211,Clarkia amoena,Onagraceae,1,23,23,1,0,Reproductive fitness and pollination biology of the four floral color morphs of Clarkia amoena var. pacifica.,,https://openalex.org/W3217284744,Reproductive fitness and pollination biology of the four floral color morphs of Clarkia amoena var. pacifica.,unreviewed
A,212,Delphinium caeruleum,Ranunculaceae,1,23,23,1,0,Screening game in plant–pollinator interactions: compound screening mechanism in flower morphology of Delphinium caeruleum,10.21203/rs.3.rs-2118643/v1,https://openalex.org/W4306923379,Screening game in plant–pollinator interactions: compound screening mechanism in flower morphology of Delphinium caeruleum,unreviewed
A,213,Ipomoea aquatica,Convolvulaceae,1,23,23,1,0,Pollinator visitation and female reproductive success in two floral color morphs of Ipomoea aquatica (Convolvulaceae),10.1007/s00606-020-01716-1,https://openalex.org/W3094397868,Pollinator visitation and female reproductive success in two floral color morphs of Ipomoea aquatica (Convolvulaceae),unreviewed
A,214,Prosthechea karwinskii,Orchidaceae,1,23,23,1,0,"Variation in the Floral Morphology of Prosthechea karwinskii (Orchidaceae), a Mexican Endemic Orchid at Risk",10.3390/plants13141984,https://openalex.org/W4400884278,"Variation in the Floral Morphology of Prosthechea karwinskii (Orchidaceae), a Mexican Endemic Orchid at Risk",unreviewed
A,215,Anacamptis coriophora,Orchidaceae,2,22,32,1,2,"Floral trait differentiation in Anacamptis coriophora : Phenotypic selection on scents, but not on colour",10.1111/jeb.13657,https://openalex.org/W3033719039,"vary within species. In this study, we compared floral colour and odour as well as selective pressures imposed upon these traits among seven populations belonging to three subspecies of the widespread, generalist orchid Anacamptis coriophora. Colour was characterized using calibrated photographs, and scents were sampled using dynamic headspace extraction and analysed using gas chromatography-mass spectrometry. We then quantified phenotypic selection exerted",unreviewed
A,216,Argyranthemum frutescens,Asteraceae,1,22,22,1,1,"Obtainment and confirmation of intergeneric hybrids between marguerite ( Argyranthemum frutescens (L.) Sch.Bip.) and two Rhodanthemum species ( R. hosmariense (Ball) B. H. Wilcox, K. Bremer & Humphries and R. catananche (Ball) B. H. Wilcox, K. Bremer & Humphries)",10.5511/plantbiotechnology.23.0202a,https://openalex.org/W4380208217,"Argyranthemum frutescens (L.) Sch.Bip. and Rhodanthemum gayanum (Coss. & Durieu) B. H. Wilcox, K. Bremer & Humphries are capable of hybridization. To expand flower color variation in this intergeneric hybrid group, we performed crosses using A.",unreviewed
A,217,Costus guanaiensis,Costaceae,1,22,22,1,1,An elevational gradient in floral traits and pollinator assemblages in the Neotropical species Costus guanaiensis var. tarmicus in Peru,10.1002/ece3.10314,https://openalex.org/W4385344381,"r‐driven selection results in floral trait variation along elevational gradients, but studies in tropical systems are lacking. We analyzed floral traits and pollinator assemblages in the Neotropical bee‐pollinated taxon Costus guanaiensis var. tarmicus across four sites along a steep elevational gradient in Peru. We found variations in floral traits of size, color, and reward, and in the pollinator assemblage along the elevational gradient. We examined o",unreviewed
A,218,Helleborus foetidus,Ranunculaceae,1,22,22,1,1,"Plant Traits, Environmental Factors, and Pollinator Visitation in Winter-flowering Helleborus foetidus (Ranunculaceae)",10.1093/aob/mci236,https://openalex.org/W2088748499,"BACKGROUND AND AIMS: This study examined the effect of plant traits and environmental factors on pollinator visitation in the winter-flowering Helleborus foetidus (Ranunculaceae) in three distant regions in the Iberian Peninsula. METHODS: Geographical variation in floral visitor assemblage, plant traits and environmental factors were analysed during the flowering season. KEY RESU",unreviewed
A,219,Linnaea borealis,Caprifoliaceae,1,22,22,1,1,"Limited mate availability decreases reproductive success of fragmented populations of Linnaea borealis, a rare, clonal self-incompatible plant",10.1093/aob/mcp007,https://openalex.org/W2120343262,"wer colour, natural pollination and fruit-set levels of L. borealis were examined in Scotland. Artificially crossed seed production was compared within and between different flower colour types and patches. KEY RESULTS: Linnaea borealis was pollinated by a diverse spectrum of insect species and the principal pollinators were muscid, syrphid and empid flies which mostly moved only small distances (<0.25 m) between flowers when foraging. Natural pollinat",unreviewed
A,220,Phyllodoce aleutica,Ericaceae,1,22,22,1,1,"Variations in floral traits of sympatric alpine shrubs, Phyllodoce caerulea and Phyllodoce aleutica, along snowmelt gradients",10.15094/00006170,https://openalex.org/W1582246713,"Abstract: Floral traits (corolla length, corolla shape, anther-stigma distance, and corolla color) of sympatric alpine shrubs, Phyllodoce caerulea and Phyllodoce aleutica, were compared among three populations having different snowmelt timing selected along snowmelt gradients (i.e., early-, middle-, and late-snowmelt population) at three snowbeds in the Taisetsu Mountains, northern Japan",unreviewed
A,221,Phyllodoce caerulea,Ericaceae,1,22,22,1,1,"Variations in floral traits of sympatric alpine shrubs, Phyllodoce caerulea and Phyllodoce aleutica, along snowmelt gradients",10.15094/00006170,https://openalex.org/W1582246713,"Abstract: Floral traits (corolla length, corolla shape, anther-stigma distance, and corolla color) of sympatric alpine shrubs, Phyllodoce caerulea and Phyllodoce aleutica, were compared among three populations having different snowmelt timing selected along snowmelt gradients (i.e., early-, middle-, and late-snowmelt population) at three snowbeds in the Taisetsu M",unreviewed
A,222,Pultenaea glabra,Fabaceae,1,22,22,1,1,"Morphological and molecular evidence refute a broad circumscription for Pultenaea glabra (Fabaceae: Mirbelieae), with implications for taxonomy, biogeography, and conservation",10.1071/sb21030,https://openalex.org/W4285388642,"Morphological and single-nucleotide polymorphism data support splitting Pultenaea glabra Benth. into eight species, including one in Victoria, and seven in eastern and northern New South Wales. Six species are newly described, five of which are, like P. glabra, narrow-range endemics within the Greater Blue",unreviewed
A,223,Rhododendron dauricum,Ericaceae,1,22,22,1,1,Anthocyanin Metabolite and Transcriptome Sequencing Analysis Reveals White Flowers in Rhododendron dauricum var. albiflorum,10.3390/horticulturae9101071,https://openalex.org/W4387052369,"Rhododendron dauricum is a cold-hardy shrub integrating ornamental, medicinal, and aromatic functions. Flower color is an important feature related to ornamental value for breeders and consumers. Nevertheless, the coloration mechanism of flo",unreviewed
A,224,Rhododendron hybridum,Ericaceae,1,22,22,1,1,Traits and anthocyanin genetic characteristics of the progeny of crosses between white 2 azalea 'Rhododendron hybridum Hot' and pink Rhododendron pulchurum 'Wan Xia',10.21203/rs.3.rs-2163314/v1,https://openalex.org/W4307249604,"of genetic knowledge involved mechanisms behind the flower color formation have hindered the breeding process. In this study, a cross was made between the female pink Rhododendron pulchurum 'WanXia' and the male white 'Rhododendron hybridum Hot'. A total of 61 hybrid progenies with four different flower colors including white, pink, rose and red were produced and analyzed to identify the inheritance pattern of flower color as well as their genetic diversit",unreviewed
A,225,Rhododendron kiusianum,Ericaceae,1,22,22,1,1,"Pigment Composition Patterns and Expression of Anthocyanin Biosynthesis Genes in Rhododendron kiusianum, R. kaempferi, and their Natural Hybrids on Kirishima Mountain Mass, Japan",10.2503/jjshs1.ch-087,https://openalex.org/W2076009824,"We compared anthocyanidin composition patterns and the expression of anthocyanin biosynthesis genes in Rhododendron kiusianum, R. kaempferi, and their natural hybrids from the Kirishima mountain mass. Compared with the habitat, phenotypic characteristics including tree height and flower color did not change in the transplanted individuals afte",unreviewed
A,226,Rosa damascena,Rosaceae,1,22,22,1,1,"FROM FRAGRANCE TO FORTUNE: UNVEILING THE BOTANICAL, SOCIOECONOMIC, AND GLOBAL SIGNIFICANCE OF ROSA DAMASCENA",10.51193/ijaer.2024.10608,https://openalex.org/W4406333996,"lineage and botanical relationships, alongside an examination of its distinctive attributes, including thorny stems, fragrant flowers, and vibrant petals. Additionally, the review uncovers genetic mysteries surrounding Rosa damascena, investigating the complex genetic interplay governing traits like fragrance production, flower color variation, and disease resistance. Furthermore, it sheds light on the socio-economic aspects of Rosa damascena cultiv",unreviewed
A,227,Scutellaria baicalensis,Lamiaceae,1,22,22,1,1,Integrated metabolome and transcriptome analyses of anthocyanin biosynthesis reveal key candidate genes involved in colour variation of Scutellaria baicalensis flowers,10.1186/s12870-023-04591-3,https://openalex.org/W4389751310,"nsects to complete pollination and provides distinct ornamental values. In some medicinal plants, diverse flower colour variations usually imply differences in active ingredients. Compared to the common bluish purple of Scutellaria baicalensis flower (SB), the natural variants present rose red (SR) and white (SW) flowers were screened out under the same growing conditions in the genuine producing area Shandong Province, China. However, the mechanism of flower",unreviewed
A,228,Zinnia elegans,Asteraceae,1,22,22,1,1,"Gamma rays induced variations in seed germination, growth and phenotypic characteristics of Zinnia elegans var. Dreamland",10.13128/ahs-20289,https://openalex.org/W2782217468,"Zinnia elegans is a herbaceous annual with diverse flower colours, flower types and plant height. Zinnia elegans are popular as pot plants and also for landscape gardening. The commercial value of Zinnia can be increased with novel traits such as flower colour and form. One of the techniques to develop plant varieties with superio",unreviewed
A,229,Centaurea cyanus,Asteraceae,3,21,46,1,2,Call Me Loyal: Investigation of Bumble Bee (Bombus terrestris) Flower Constancy in a Semi-Field Environment,,https://openalex.org/W3043062601,"our morphs could be reliably grown, were consistently visited by bees, provided a constant food source of similar quality and were not greatly affected by disease or pests. Snapdragon (Antirrhinum majus) and cornflower (Centaurea cyanus) were identified as the flowering plant species to best meet this selection criteria. Further analyses (flower colour spectrum, pollen quality and nectar quantity) were conducted on the chosen flowering plant species. B",unreviewed
A,230,Curcuma alismatifolia,Zingiberaceae,1,21,21,1,0,Effect of Acute Gamma Irradiation on Curcuma alismatifolia Varieties and Detection of DNA Polymorphism through SSR Marker,10.1155/2014/631813,https://openalex.org/W2051333531,Effect of Acute Gamma Irradiation on Curcuma alismatifolia Varieties and Detection of DNA Polymorphism through SSR Marker,unreviewed
A,231,Primula vulgaris,Primulaceae,1,21,21,1,0,Colour polymorphism in common primrose (Primula vulgaris Huds.): many colours–many species?,10.1007/s00606-013-0780-3,https://openalex.org/W2143398318,Colour polymorphism in common primrose (Primula vulgaris Huds.): many colours–many species?,unreviewed
A,232,Rheum palmatum,Polygonaceae,1,21,21,1,0,Transcriptome profiles of yellowish-white and fuchsia colored flowers in the Rheum palmatum complex reveal genes related to color polymorphism,10.1007/s11103-022-01299-0,https://openalex.org/W4290792296,Transcriptome profiles of yellowish-white and fuchsia colored flowers in the Rheum palmatum complex reveal genes related to color polymorphism,unreviewed
A,233,Pedicularis comosa,Orobanchaceae,3,20,46,1,3,Species distribution modelling predicts the extinction of the east-pyrenean local endemic form of Pedicularis comosa: P. c. asparagoides in a near future,10.57890/7x9tgm19,https://openalex.org/W7125254413,"nt species. Due to their patrimonial importance and the susceptibility of mountainous species to climate and land-use changes, the conservation of endemic species in the Pyrenees is a crucial issue. Local populations of Pedicularis comosa in the Eastern Pyrenees provide an interesting biological model for studying climate change effects on mountain plant biodiversity. Here, an endemic pink-flowered morphotype described as Pedicularis comosa subsp. aspara",unreviewed
A,234,Geranium sylvaticum,Geraniaceae,2,20,39,1,2,Temperature-dependent visitation rates of bumblebees to different colour-morphs of Geranium sylvaticum (Linnaeus 1753),10.15298/euroasentj.17.5.07,https://openalex.org/W2903286594,"g of pollintors. Dspit oth ftors ing importnt, no stuis hv min th intrtiv ffts of tmprtur n olour n ho this m impt th mintnn of nturl florl olour polmorphisms. W tst ho tmprtur influn umls (Bombus spp.) visittion rts to Geranium sylvaticum (Linnus 1753) plnts oth in grnhous n fil sttings. G. sylvaticum shos olour polmorphism mong popultions, n ini-viuls n lssifi into to isrt morphs, rk morphs or pl morphs s on thir visil light. W foun tht uml visittion rt",unreviewed
A,235,Brassica oleracea,Brassicaceae,2,20,38,1,2,The molecular genetics of curd morphology and the domestication of cauliflower (Brassica oleracea L. var. botrytis L.),,https://openalex.org/W2338245154,"rating, arrested inflorescence and floral meristems. Recent analysis of the similar phenotype in the ap1-1/cal-1 mutant of the related crucifer Arabidopsis thaliana has led to speculation that the orthologous genes from Brassica oleracea L. may be responsible for this characteristic trait. \n \nApplication of molecular genetic analysis to this hypothesis allows the presentation of a genetic model based on specific, mapped loci of BoCAL and BoAP 1. This",unreviewed
A,236,Dahlia variabilis,Asteraceae,2,20,38,1,1,Selection of non-fading lines for high quality cut-flower production in Dahlia variabilis ′Nessho′ by elucidating mechanisms of low temperature induced flower color fading,10.18926/67829,https://openalex.org/W7111286713,Selection of non-fading lines for high quality cut-flower production in Dahlia variabilis ′Nessho′ by elucidating mechanisms of low temperature induced flower color fading,unreviewed
A,237,Osmanthus fragrans,Oleaceae,2,20,33,1,1,Recent Advances in Flower Color and Fragrance of Osmanthus fragrans,10.3390/f14071403,https://openalex.org/W4383723672,Recent Advances in Flower Color and Fragrance of Osmanthus fragrans,unreviewed
A,238,Rhododendron molle,Ericaceae,2,20,30,1,1,Strategies of flowering plants to avoid pollen collection by undesirable flower visitors. A commentary on ‘High toxin concentration in pollen may deter collection by bees in butterfly-pollinated Rhododendron molle ’,10.1093/aob/mcae088,https://openalex.org/W4399897574,Strategies of flowering plants to avoid pollen collection by undesirable flower visitors. A commentary on ‘High toxin concentration in pollen may deter collection by bees in butterfly-pollinated Rhododendron molle ’,unreviewed
A,239,Antirrhinum charidemi,Plantaginaceae,1,20,20,1,0,Fine-scale genetic differentiation in the bee-specialized Antirrhinum charidemi covaries more strongly with spatial isolation than with corolla colour,10.1093/aobpla/plaf017,https://openalex.org/W4408950998,Fine-scale genetic differentiation in the bee-specialized Antirrhinum charidemi covaries more strongly with spatial isolation than with corolla colour,unreviewed
A,240,Brachyloma stenolobum,Ericaceae,1,20,20,1,0,"Brachyloma stenolobum (Ericaceae: Styphelioideae: Styphelieae), a new, white-flowered species for Western Australia",10.58828/nuy00717,https://openalex.org/W4328002263,"Brachyloma stenolobum (Ericaceae: Styphelioideae: Styphelieae), a new, white-flowered species for Western Australia",unreviewed
A,241,Caladenia fulva,Orchidaceae,1,20,20,1,0,Why Variation in Flower Color May Help Reproductive Success in the Endangered Australian Orchid Caladenia fulva,10.3389/fpls.2021.599874,https://openalex.org/W3126609450,Why Variation in Flower Color May Help Reproductive Success in the Endangered Australian Orchid Caladenia fulva,unreviewed
A,242,Calceolaria uniflora,Calceolariaceae,1,20,20,1,0,Geographic variation in flower color patterns within Calceolaria uniflora Lam. in Southern Patagonia,10.1007/s00606-003-0083-1,https://openalex.org/W2016058514,Geographic variation in flower color patterns within Calceolaria uniflora Lam. in Southern Patagonia,unreviewed
A,243,Calligonum comosum,Polygonaceae,1,20,20,1,1,Dimorphic fruit colour is associated with differences in germination of Calligonum comosum,10.1139/cjb-2018-0167,https://openalex.org/W2921193735,"Calligonum comosum L’Hér is a perennial evergreen shrub that produces dimorphic fruits of distinctly yellow or red colour. The species is found on sand dunes of the Middle East, is valued as a highly palatable livestock feed that survives",unreviewed
A,244,Carya cathayensis,Juglandaceae,1,20,20,1,0,Comprehensive identification and analysis of circRNAs during hickory (Carya cathayensis Sarg.) flower bud differentiation,10.3389/fpls.2022.1000489,https://openalex.org/W4313485225,Comprehensive identification and analysis of circRNAs during hickory (Carya cathayensis Sarg.) flower bud differentiation,unreviewed
A,245,Clematis tangutica,Ranunculaceae,1,20,20,1,0,Analysis of Floral Color Differences between Different Ecological Conditions of Clematis tangutica (Maxim.) Korsh,10.3390/molecules28010462,https://openalex.org/W4313572715,Analysis of Floral Color Differences between Different Ecological Conditions of Clematis tangutica (Maxim.) Korsh,unreviewed
A,246,Coriandrum sativum,Apiaceae,1,20,20,1,0,Variable expression of anthocyanin in flower and stem of coriander (Coriandrum sativum L.): Breeding implications,10.22271/chemi.2021.v9.i1q.11384,https://openalex.org/W3125297528,Variable expression of anthocyanin in flower and stem of coriander (Coriandrum sativum L.): Breeding implications,unreviewed
A,247,Cyclopogon elatus,Orchidaceae,1,20,20,1,1,A simple floral fragrance and unusual osmophore structure in Cyclopogon elatus (Orchidaceae),10.1111/j.1438-8677.2008.00140.x,https://openalex.org/W1989800006,"We studied gland morphology, anatomy and the chemical composition of the floral fragrance in the sweat bee-pollinated orchid Cyclopogon elatus. This is apparently the first such analysis for any Cyclopogon species, and one of very few studies in which both odour and osmophore are characterised in a nectar-rewarding orchid. Structures responsible for floral sce",unreviewed
A,248,Dactylorhiza romana,Orchidaceae,1,20,20,1,1,Systematics and evolution of the Dactylorhiza romana/sambucina polyploid complex (Orchidaceae),10.1111/j.1095-8339.2006.00573.x,https://openalex.org/W2131150101,"The European-Mediterranean-Oriental Dactylorhiza romana/sambucina polyploid complex was studied with regard to genetic and morphological variation patterns. Allozyme and morphometric data were collected from 24 and 19 populations, respectively, initially identified as D. fla",unreviewed
A,249,Dianthus virgineus,Caryophyllaceae,1,20,20,1,1,Weak Genetic Isolation and Putative Phenotypic Selection in the Wild Carnation Dianthus virgineus (Caryophyllaceae),10.3390/biology12101355,https://openalex.org/W4387876941,"ible to dissect micro-evolutionary scenarios involving natural selection and neutral evolution. In this work, we tested the patterns of intraspecific genetic and phenotypic variation along an elevational gradient, using Dianthus virgineus as study system. We genotyped genome-wide SNPs through ddRAD sequencing and quantified phenotypic variation through multivariate morphological variation. We assessed patterns of variation by testing the statistical asso",unreviewed
A,250,Etlingera elatior,Zingiberaceae,1,20,20,1,1,"Morphological Characteristics of Kecombrang (Etlingera elatior (Jack) R. M. Smith) in Several Regions in Aceh Province, Sumatra",10.15408/kauniyah.v17i2.34900,https://openalex.org/W4396731110,"ed on these observations, two variations of the kecombrang plant have been found based on the color of the bracts, namely the red and pink variants. Based on morphological characters of vegetative organs, all samples of Etlingera elatior had a similarity distance coefficient from 67 to 86%. In addition, the kecombrang plants found in the highlands of Central Aceh have a larger size in leaf and inflorescent compared to samples from other locations.Abstra",unreviewed
A,251,Gongora quinquenervis,Orchidaceae,1,20,20,1,0,Variation in floral fragrances and pollinators in the Gongora quinquenervis complex (Orchidaceae) in central Panama / by William Mark Whitten.,10.5962/bhl.title.42485,https://openalex.org/W2484764130,Variation in floral fragrances and pollinators in the Gongora quinquenervis complex (Orchidaceae) in central Panama / by William Mark Whitten.,unreviewed
A,252,Gynandropsis gynandra,Cleomaceae,1,20,20,1,1,"Association between vitamin content, plant morphology and geographical origin in a worldwide collection of the orphan crop Gynandropsis gynandra (Cleomaceae)",10.1007/s00425-019-03142-1,https://openalex.org/W2937915756,"MAIN CONCLUSION: The variability in nutrient content and morphology in Gynandropsis gynandra is associated with the geographic origin of the accessions and provides a basis for breeding for higher levels of vitamin C, carotenoids or tocopherols in higher-yielding cultivars. We examined the variation in caroteno",unreviewed
A,253,Heliconia irrasa,Heliconiaceae,1,20,20,1,1,Long-Tailed Hermit Hummingbird Visits to Inflorescence Color Morphs of Heliconia irrasa,10.2307/1367077,https://openalex.org/W2328833611,Visits by Long-tailed Hermit hummingbirds (Phaethornis superciliosus) to flowers of different inflorescence color morphs in a natural population of Heliconia irrasa were monitored indirectly using fluorescent powder. The two color morphs (red and yellow) were indistinguishable with respect to amount and rate of reward (nectar) offered to pollinators. The birds did not appear to pre,unreviewed
A,254,Heracleum sphondylium,Apiaceae,1,20,20,1,0,On flower visitors and true pollinators: The case of protandrous Heracleum sphondylium L. (Apiaceae),10.1007/s00606-006-0493-y,https://openalex.org/W2113691694,On flower visitors and true pollinators: The case of protandrous Heracleum sphondylium L. (Apiaceae),unreviewed
A,255,Lathyrus sativus,Fabaceae,1,20,20,1,0,Construction of A GBS-Based High-Density Genetic Map and Flower Color-Related Loci Mapping in Grasspea (Lathyrus sativus L.),10.3390/plants11162172,https://openalex.org/W4292554594,Construction of A GBS-Based High-Density Genetic Map and Flower Color-Related Loci Mapping in Grasspea (Lathyrus sativus L.),unreviewed
A,256,Lilium tsingtauense,Liliaceae,1,20,20,1,1,Exploitation of Diversity for Morphological Traits in Lilium tsingtauense under Different Habitats,10.15835/nsb.6.2.9347,https://openalex.org/W4243287552,"In this study naturally growing morphological variation of Lilium tsingtauense (Korean wheel lily), from southern Chung San Island to northern Mount Seorak, was investigated in 16 habitats around the country. Morphological analysis revealed that this species had its own unique characteristics in d",unreviewed
A,257,Linum usitatissimum,Linaceae,1,20,20,1,0,QTL mapping and molecular characterization of the classical D locus controlling seed and flower color in Linum usitatissimum (flax),10.1038/s41598-017-11565-7,https://openalex.org/W2767959263,QTL mapping and molecular characterization of the classical D locus controlling seed and flower color in Linum usitatissimum (flax),unreviewed
A,258,Lobelia erinus,Campanulaceae,1,20,20,1,0,Analyses of anthocyanin modification pathway and glycosyltransferase genes involved in flower coloration in Lobelia erinus [an abstract of entire text],,https://openalex.org/W2626376778,Analyses of anthocyanin modification pathway and glycosyltransferase genes involved in flower coloration in Lobelia erinus [an abstract of entire text],unreviewed
A,259,Mikania micrantha,Asteraceae,1,20,20,1,0,Phenolic Acids and Flavonoids Play Important Roles in Flower Bud Differentiation in Mikania micrantha: Transcriptomics and Metabolomics,10.3390/ijms242316550,https://openalex.org/W4388849123,Phenolic Acids and Flavonoids Play Important Roles in Flower Bud Differentiation in Mikania micrantha: Transcriptomics and Metabolomics,unreviewed
