priority_tier,rank,canonical_name,family,n_works,max_score,total_score,n_title_matches,n_context_matches,best_title,best_doi,best_openalex_id,best_match_evidence,review_status
A,96,Gerbera jamesonii,Asteraceae,2,25,37,2,1,Flower colour variations in gerbera (Gerbera jamesonii) population using image analysis,,https://openalex.org/W1781279088,"Image analysis was performed on ligules of 211 progenies and seven parental accessions of gerbera (Gerbera jamesonii Bolus ex. Hooker F), to quantify colour variation. The colour variations were assessed based on mean values of (1) red, green, blue (RGB), (2) hue and saturation (HS) colour channels of ligule colour. Multivariate clust",unreviewed
A,97,Arum maculatum,Araceae,4,22,75,2,4,Variation in scent amount but not in composition correlates with pollinator visits within populations of deceptive Arum maculatum L. (Araceae),10.3389/fpls.2022.1046532,https://openalex.org/W4313987291,"al emission and composition) and floral visitors in deceptive plants, we studied floral scent, visitor assemblages, and fruit set in two populations of fly-pollinated (Psychodidae, Sphaeroceridae; Diptera) and deceptive Arum maculatum from Austria (JOS) and northern Italy (DAO). By correlating individual data on floral scent and visitor assemblages, we show that inter-individual variation in floral scent partly explains variation in visitor assemblag",unreviewed
A,98,Chimonanthus praecox,Calycanthaceae,2,22,44,2,2,Metabolomic and transcriptomic analyses jointly reveal the mechanism underlying the reddening of Chimonanthus praecox stamens,10.3389/fpls.2024.1491246,https://openalex.org/W4404541331,"Introduction Flower characteristics are crucial ornamental and reproductive traits in Chimonanthus praecox . Over its long cultivation history, variations have been observed in the floral organs, primarily in the petals, with limited reports on stamen traits. Stamen variation, integral to the mating system, can enhance the p",unreviewed
A,99,Gossypium arboreum,Malvaceae,2,22,44,2,2,Transcriptomic and metabolomic profiling of flavonoid biosynthesis provide novel insights into petals coloration in Asian cotton (Gossypium arboreum L.),10.21203/rs.3.rs-1822828/v1,https://openalex.org/W4285084292,"is a clear lack of studies concerning intricate mechanism cotton flower-color differentiation. Hereby, we report an integrative approach utilizing transcriptome and metabolome concerning flower color variation in three Gossypium arboreum cultivars. Results A total of 215 differentially accumulated metabolites (DAMs) were identified, including 83 differentially accumulated flavonoid metabolites (DAFs). Colorless kaempferol was more abundant in white flow",unreviewed
A,100,Angelica sylvestris,Apiaceae,2,22,37,2,1,Spatiotemporal variation in the pollination systems of a supergeneralist plant: is Angelica sylvestris (Apiaceae) locally adapted to its most effective pollinators?,10.1093/aob/mcy140,https://openalex.org/W2886229130,"f the pollination system. We also explored whether variation in pollinator assemblages was associated with variation in floral traits, and whether this variation influences reproductive output. Methods: The focus was on Angelica sylvestris, a common European species visited by a taxonomically diverse insect assemblage. In three populations, located along an ~700-km transect, over three growth seasons insect visitors were identified, their effectiveness wa",unreviewed
A,101,Fuchsia magellanica,Onagraceae,2,22,34,2,1,Effect of nectar‐robbing birds on fruit set of Fuchsia magellanica in Tierra Del Fuego: a disrupted mutualism,10.1046/j.1365-2435.1998.00212.x,https://openalex.org/W2040228045,"1. This paper investigates spatial habitat variation in flower visitation by avian pollinators (mainly Hummingbirds) and nectar robbers to Fuchsia magellanica at the southern limit of its range, Tierra del Fuego, and their effects on plant reproductive success. 2. The plant‐pollination mutualism appears to be disrupted as Hummingbirds ( Sephanoides galeritus) are rare at this",unreviewed
A,102,Cicer arietinum,Fabaceae,2,21,36,2,0,Exploring the Genetic Diversity and Population Structure in Chickpea Cultivated Germplasm & Genetic Basis of Flower Color Polymorphism in Chickpea (Cicer arietinum L.),,https://openalex.org/W3004089170,Exploring the Genetic Diversity and Population Structure in Chickpea Cultivated Germplasm & Genetic Basis of Flower Color Polymorphism in Chickpea (Cicer arietinum L.),unreviewed
A,103,Silene dioica,Caryophyllaceae,3,20,45,2,3,Inheritance and reproductive consequences of floral anthocyanin deficiency in Silene dioica ( Caryophyllaceae ),10.3732/ajb.1400136,https://openalex.org/W2065254881,"utations can persist because they can affect not only pollinator visitation but also plant fertility and performance.• METHODS: We collected rare white-flowered (anthocyanin-deficient) and common pink-flowered morphs of Silene dioica from natural populations in Switzerland. First- and second-generation hybrids between pink and white morphs, as well as backcrosses toward white morphs were produced, and the proportion of white-flowered offspring was d",unreviewed
A,104,Cypripedium candidum,Orchidaceae,2,20,40,2,1,"Latitudinal variation in pollinator and co-flowering communities, and their effects on reproductive success in a rewardless orchid, Cypripedium candidum",,https://openalex.org/W3208451086,"Latitudinal variation in pollinator and co-flowering communities, and their effects on reproductive success in a rewardless orchid, Cypripedium candidum",unreviewed
A,105,Disphyma australe,Aizoaceae,2,20,40,2,2,Evaluating the functional role of betacyanin in salinity tolerance of Horokaka (Disphyma australe),10.26686/wgtn.17148455,https://openalex.org/W3084231962,"betalain pigments are thought to function in salinity stress tolerance. However, minimal research has been conducted to support this salinity tolerance hypothesis due to a lack of an appropriate model species. Horokaka (Disphyma australe) exhibits colour dimorphism among populations, green and red morphs grow contiguously in coastal environments where the frequency of red morphs positively correlates with increased substrate salinity. Betacyanins have p",unreviewed
A,106,Nigella degenii,Ranunculaceae,2,20,35,2,1,COMPARATIVE ANALYSES OF POPULATION STRUCTURE IN TWO SUBSPECIES OF NIGELLA DEGENII : EVIDENCE FOR DIVERSIFYING SELECTION ON POLLEN‐COLOR DIMORPHISMS,10.1111/j.0014-3820.2006.tb01133.x,https://openalex.org/W4320996989,"fferent environments may therefore favor different pigmentation phenotypes. We examined whether spatially varying selection has played a major role in shaping large‐scale patterns of differentiation in two subspecies of Nigella degenii (Ranunculaceae), with particular emphasis on pollen color. The two subspecies appear to have been genetically isolated for substantial periods of time and, therefore, provide a “replicated test” for the effect of natura",unreviewed
A,107,Allium schoenoprasum,Amaryllidaceae,2,20,32,2,0,Genetic analysis of flower colour variation in Allium schoenoprasum L. (wild chives),10.1038/hdy.1988.39,https://openalex.org/W2025684567,Genetic analysis of flower colour variation in Allium schoenoprasum L. (wild chives),unreviewed
A,108,Polygonatum kingianum,Asparagaceae,2,20,32,2,1,Molecular identification and phylogenetic analysis of Polygonatum Kingianum with different floral colors on the basis of chloroplast genomes,10.1186/s12870-025-07147-9,https://openalex.org/W4414855421,"Polygonatum kingianum, a plant with both medicinal and edible properties, demonstrates considerable variation in perianth coloration, making its differentiation from related species through morphological characteristics particularly challeng",unreviewed
A,109,Stellera chamaejasme,Thymelaeaceae,4,19,56,2,3,Canalized gene regulatory networks stabilize floral polymorphism and enable modular transgressive expression,10.64898/2026.04.16.719044,https://openalex.org/W7155106124,"rphisms frequently persist across heterogeneous environments despite ongoing gene flow, yet the regulatory mechanisms maintaining discrete phenotypes remain unclear. We tested whether alternative flower-colour morphs in Stellera chamaejasme L. are maintained by canalized gene regulatory architectures that stabilize expression around morph-specific optima. We used a pan-transcriptomic and eco-evolutionary framework integrating genome-wide gene expression pr",unreviewed
A,110,Arabidopsis thaliana,Brassicaceae,8,18,101,2,6,Genetic Mechanisms Behind Flower Color Variation in Caulanthus Amplexicaulis var. Amplexicaulis (CAA) and Caulanthus Amplexicaulis var. Barbarae (CAB),,https://openalex.org/W1217664957,"te the gene for flower color in two species of the flower C. amplexicaulis, CAA and CAB, by looking for sequence similarity between the Caulanthus genome and known transcription factors involved in pigment production in Arabidopsis thaliana using plants from the family Brassicaceae as intermediates. Once a high degree of similarity was found in a region of the CAB and CAA genomes, a gene model was developed to achieve an understanding of why CAA is a diffe",unreviewed
A,111,Catharanthus roseus,Apocynaceae,3,18,47,2,2,Inheritance of Flower Color in Periwinkle: Orange-Red Corolla and White Eye,10.1093/jhered/93.1.55,https://openalex.org/W1966696489,"The commonly found flower colors in periwinkle (Catharanthus roseus)--pink, white, red-eyed, and pale pink center--are reported to be governed by the epistatic interaction between four genes--A, R, W, and I. The mode of inheritance of an uncommon flower color, orange-red corolla and whi",unreviewed
A,141,Anemone palmata,Ranunculaceae,1,39,39,1,1,Pollinator response to yellow UV ‐patterned versus white UV ‐patternless flower dimorphism in Anemone palmata,10.1111/plb.13702,https://openalex.org/W4402126765,"Flower colour polymorphisms are uncommon but widespread among angiosperms and can be maintained by a variety of balancing selection mechanisms. Anemone palmata is mostly yellow-flowered, but white-flowered plants coexist in some populations. We analysed the distribution of colour morphs of A. palmata across its range. We also characterised their colours and compared their vege",unreviewed
A,142,Boechera stricta,Brassicaceae,1,39,39,1,1,Ecological causes and consequences of flower color polymorphism in a self‐pollinating plant ( Boechera stricta ),10.1111/nph.14998,https://openalex.org/W2790063807,"this mechanism cannot explain flower color polymorphisms in self-pollinating species. Indirect selection mediated via biotic and abiotic stresses could maintain flower color variation in these systems. The selfing forb, Boechera stricta, typically displays white flowers, but some individuals produce purple flowers. We quantified environmental correlates of flower color in natural populations. To disentangle plasticity from genotypic variation, we perfo",unreviewed
A,143,Cymbidium kanran,Orchidaceae,1,39,39,1,1,Anthocyanin Genes Involved in the Flower Coloration Mechanisms of Cymbidium kanran,10.3389/fpls.2021.737815,https://openalex.org/W3207916119,"tacular flowers and ecological adaptations. Various polymorphisms of orchid flower colour can attract pollinators and be recognised as valuable horticultural ornamentals. As one of the longest historic cultured orchids, Cymbidium kanran has been domesticated for more than 2,500 years and is an ideal species to study coloration mechanisms because of plentiful variations in floral coloration and abundant traditional varieties. In this study, we used two",unreviewed
A,144,Geranium nepalense,Geraniaceae,1,39,39,1,1,Flower Colour Polymorphism in Geranium nepalense (Geraniaceae): Adaptation to Non-Pollinator Agents,10.3161/15052249pje2016.64.4.007,https://openalex.org/W2588750614,"ABSTRACT Flower colour polymorphism is attributed to pollinator or non-pollinator mediated selection. Geranium nepalense has common white morph and very rare pink morph. We compared pollinator visitation frequencies, temperature and soil moisture between two morphs in the mixed morph population. We also compared morph ratio and reproducti",unreviewed
A,145,Leavenworthia stylosa,Brassicaceae,1,39,39,1,1,Reproductive character displacement shapes a spatially structured petal color polymorphism in Leavenworthia stylosa,10.1111/evo.12659,https://openalex.org/W2005881429,"cological character displacement) or the risk of forming hybrids with reduced fitness (reproductive character displacement). We test these and alternative hypotheses to explain a yellow-white petal color polymorphism in Leavenworthia stylosa, where yellow morphs are spatially associated with a white-petaled congener (Leavenworthia exigua) that produces hybrids with complete pollen sterility. A reciprocal transplant experiment found limited evidence of local",unreviewed
A,146,Leptocereus scopulophilus,Cactaceae,1,39,39,1,1,"Flower morphs in Leptocereus scopulophilus (Cactaceae) and their reproductive success in Pan de Matanzas, Cuba",10.25223/brad.n40.2022.a1,https://openalex.org/W4280574450,"Flower colour polymorphism is one of the most attractive features in pollination studies. This article investigates the factors influencing the frequency of flower colour polymorphism in the Cuban cactus Leptocereus scopulophilus, where four flower morphs have been reported. We determined whether the colour of the tepals is a discrete variable and estimated morphs frequency in the population. To explain the frequencies of the flower morphs, we c",unreviewed
A,147,Lupinus pilosus,Fabaceae,1,39,39,1,1,Flower‐Colour Polymorphism in Lupinus pilosus in Israel,10.1111/j.1439-0523.1987.tb01189.x,https://openalex.org/W1985541337,"Abstract Four rare flower‐colour mutants were detected in natural populations of Lupinus pilosus in Israel. The breeding systems and genetic bases of three oif them were examined. Mutants were tagged in wild populations and seed obtained upon open pollination was collected and grown in a, net house which was insect",unreviewed
A,148,Ophiorrhiza japonica,Rubiaceae,1,39,39,1,1,Maintenance of flower color dimorphism in Ophiorrhiza japonica (Rubiaceae): responses to fluctuating temperatures in a dolomite Karst region,10.3389/fpls.2024.1495112,https://openalex.org/W4405558795,"ther non-pollinator stress factors. Generally, flower color polymorphism demonstrates effective acclimatization linked to either pollinator-mediated selection or pleiotropic effects. Methods: To test these hypotheses in Ophiorrhiza japonica, we compared pollinator visitation frequencies and plant traits between pink and white morphs in Shibing, a dolomite Karst region recognized as a World Natural Heritage Site. We also assessed the ratio of flower morphs",unreviewed
A,149,Clivia miniata,Amaryllidaceae,1,34,34,1,1,Polymorphisms in two key anthocyanic genes of clivia ( Clivia miniata L.) reveal evidence of selection and possible association with flower pigmentation,10.1093/jeb/voae025,https://openalex.org/W4392542868,"s in addition to population genetic parameters including selection, recombination, and linkage disequilibrium (LD). The current study aimed to find sequence variants in 2 anthocyanin biosynthetic genes (DFR and bHLH) of Clivia miniata and use the data to assess population genetic factors from a random collection of orange/red- and yellow-flowered specimens. Overall, average nucleotide diversity in the 2 anthocyanin genes was moderate (π = 0.00646), w",unreviewed
A,150,Lupinus perennis,Fabaceae,1,33,33,1,1,Effects of Flower Color on Pollination and Seed Production in Lupinus Perennis,,https://openalex.org/W3041830603,"We examined how flower color morphs (blue vs white) in Lupinus perennis affect the probability of a flower setting fruit, average mass of a seed produced, and average number of seeds per pod.",unreviewed
A,151,Buddleja delavayi,Scrophulariaceae,1,31,31,1,1,Comparison of floral properties and breeding system in dimorphic Buddleja delavayi (Scrophulariaceae),10.1111/jse.12123,https://openalex.org/W1507846092,"Abstract In this study, floral color, scent composition and emission rate, nectar property, pollinators, and breeding system of dimorphic Buddleja delavayi Gagnep. were investigated. Flower color of B. delavayi was determined using a standard color chart and spectrophotometer, and two distinct color polymorphisms were observed having purple or white flowers. Floral scents",unreviewed
A,152,Lilium sulphureum,Liliaceae,1,31,31,1,1,Studies on Intraspecific Differentiations of Flowering Colors of Lilium sulphureum Baker apud Hook.f.in Yunnan,,https://openalex.org/W2357395938,"Intraspecific differentiations in flower color are obvious in Lilium sulphureum Baker apud Hook.f.in Yunnan.There are polymorphsim within populations and obvious polytypism among populations.The flower color presents gradient variation.Specially,variations of flower color within Puer population are",unreviewed
A,153,Narcissus pseudonarcissus,Amaryllidaceae,1,31,31,1,1,Transcriptome Sequencing and Biochemical Analysis of Perianths and Coronas Reveal Flower Color Formation in Narcissus pseudonarcissus,10.3390/ijms19124006,https://openalex.org/W2904598959,"Narcissus pseudonarcissus is an important bulbous plant with white or yellow perianths and light yellow to orange-red coronas, but little is known regarding the biochemical and molecular basis related to flower color polymorphisms. To investigat",unreviewed
A,154,Salvia hispanica,Lamiaceae,1,31,31,1,1,Review of floral polymorphism in chía (Salvia hispanica L.): Modified cause,10.35429/jnas.2020.20.7.14.20,https://openalex.org/W3166774049,"This article reviews the current state of knowledge about the color of the flower of the chia (Salvia hispanica L.) plant because it presents different colors, within a population that was the basis for the generation of five internationally marketed varieties. After a historical review of the most influential studies on floral c",unreviewed
A,155,Solanum carolinense,Solanaceae,1,31,31,1,1,A field investigation into potential reproductive and resistance advantages of purple-petalled plants in polymorphic populations of horsenettle (Solanum carolinense),10.5091/plecevo.128527,https://openalex.org/W4403078083,"lutionary biologists alike. Nevertheless, the diversity of genetic factors and ecological interactions that act to maintain flower-color polymorphisms over time are understood for very few species. Here, we suggest that Solanum carolinense (horsenettle) makes an excellent model system for studying the evolutionary ecology of a flower-color polymorphism, and we begin to shed insight into factors that might affect the stability of the polymorphism. Material",unreviewed
A,156,Viola diversifolia,Violaceae,1,31,31,1,1,Polymorphisme morphologique chez le pollen et la fleur de Viola diversifolia (Gingins) Becker,10.1080/01811789.1990.10827015,https://openalex.org/W2033544458,"Click to increase image sizeClick to decrease image sizeSummaryPollen and flower color polymorphism were both found in Viola diversifolia. In all populations studied, 3, 4, 5 and 6-apertured pollen grains were observed. The proportions of these four morphs did not differ significantly between flowers of the same individual, nor between individuals of the",unreviewed
A,157,Lysimachia monelli,Primulaceae,4,30,111,1,4,Linking environmental adaptation and genetic structure to the biogeography of flower colour lineages in Lysimachia monelli (Primulaceae),10.1111/plb.70100,https://openalex.org/W4413930938,"ctive traits such as flower colour can have a profound influence on the diversification of plant species, making understanding their evolutionary ramifications one of the foremost challenges for evolutionary biologists. Lysimachia monelli is a Mediterranean endemic with two markedly divergent flower colour lineages, blue and orange, which do not coexist within the same populations. We examined the relationship between lineage divergence and environmental",unreviewed
A,158,Lamium album,Lamiaceae,4,30,69,1,4,"Geographic Variation in Flower Size and Flower-Visitor Composition of Two Bumblebee-Pollinated, Spring-Flowering Herbs, &lt;i&gt;Lamium album&lt;/i&gt; L. var. &lt;i&gt;barbatum&lt;/i&gt; (Lamiaceae) and &lt;i&gt;Meehania urticifolia&lt;/i&gt; (Lamiaceae)",10.4236/ajps.2015.65079,https://openalex.org/W1991428849,"as pollinator size, abundance of nectar robbers, and temperature. To elucidate the effect of geographic variation of flower-visitor fauna on flower size, we investigated two spring-flowering, bumblebee-pollinated herbs, Lamium album L. var. barbatum (seven populations) and Meehania urticifolia (five populations), in central Japan. Flower-size variations were not correlated with altitude (an index of abiotic environmental change) in either species,",unreviewed
A,159,Wahlenbergia albomarginata,Campanulaceae,3,30,50,1,3,Where have all the blue flowers gone: pollinator responses and selection on flower colour in New Zealand Wahlenbergia albomarginata,10.1111/j.1420-9101.2011.02430.x,https://openalex.org/W1731095030,"correlated traits on pollinator visitation and pollen transfer. We combined selection analysis and phenotypic manipulations to measure the effect of petal colour on visitation and pollen export at two spatial scales in Wahlenbergia albomarginata. This species is representative of many New Zealand alpine herbs that have secondarily evolved white or pale flowers. The major pollinators, solitary bees, exerted phenotypic selection on flower size but not colour, qua",unreviewed
A,160,Eruca sativa,Brassicaceae,2,30,40,1,2,Natural Variation in Flower Color and Scent in Populations of Eruca sativa (Brassicaceae) Affects Pollination Behavior of Honey Bees,10.1093/jisesa/iez038,https://openalex.org/W2946516416,"Plants of Eruca sativa Mill. (Brassicaceae) from desert and Mediterranean populations in Israel differ in flower color and size. In the desert habitat, the population has higher abundance of flowers with cream color and longer petals, whereas",unreviewed
A,161,Meehania urticifolia,Lamiaceae,2,30,40,1,2,"Geographic Variation in Flower Size and Flower-Visitor Composition of Two Bumblebee-Pollinated, Spring-Flowering Herbs, &lt;i&gt;Lamium album&lt;/i&gt; L. var. &lt;i&gt;barbatum&lt;/i&gt; (Lamiaceae) and &lt;i&gt;Meehania urticifolia&lt;/i&gt; (Lamiaceae)",10.4236/ajps.2015.65079,https://openalex.org/W1991428849,"emperature. To elucidate the effect of geographic variation of flower-visitor fauna on flower size, we investigated two spring-flowering, bumblebee-pollinated herbs, Lamium album L. var. barbatum (seven populations) and Meehania urticifolia (five populations), in central Japan. Flower-size variations were not correlated with altitude (an index of abiotic environmental change) in either species, but in both species they were related to the local species com",unreviewed
A,162,Gentiana triflora,Gentianaceae,1,30,30,1,1,Identification of Candidate Genes Responsible for Flower Colour Intensity in Gentiana triflora,10.3389/fpls.2022.906879,https://openalex.org/W4283395540,"Gentians cultivated in Japan ( Gentiana triflora and Gentiana scabra and hybrids) have blue flowers, but flower colour intensity differs among cultivars. The molecular mechanism underlying the variation in flower colour intensity is unclear. Here, we produced F 2 prog",unreviewed
A,163,Leptosiphon androsaceus,Polemoniaceae,1,30,30,1,1,Climate-Related Floral and Vegetative Size Variation in Leptosiphon androsaceus (Polemoniaceae),10.31979/etd.78dw-hfsd,https://openalex.org/W86369981,"biotic and abiotic factors vary. Variation is the basis of evolution, and natural selection, acting on trait variation, can lead to speciation. For this study, floral and vegetative character traits of false babystars (Leptosiphon androsaceus, Polemoniaceae) were analyzed within four populations at Henry W. Coe State Park in 2011. Traits were measured to assess changes in size along a moisture availability gradient. Stable carbon isotope ratio samples were c",unreviewed
A,164,Loropetalum chinense,Hamamelidaceae,1,30,30,1,1,Phenotypic Diversity Analysis of the Progeny Variation of a ‘Mosaic Leaf’ Loropetalum chinense var. rubrum Based on Flower Organ Characteristics,10.3390/d14110913,https://openalex.org/W4307633527,"Loropetalum chinense var. rubrum is a common landscape plant. Because of the preference for the ‘red leaf’ trait, the ‘flower color’ trait was ignored in breeding, and the genetic diversity of L. chinense var. rubrum was replaced by a few g",unreviewed
A,165,Mammillaria haageana,Cactaceae,1,30,30,1,1,Evolution of flower allometry and pigmentation in Mammillaria haageana (Cactaceae),10.1186/s12870-021-03386-8,https://openalex.org/W4206993445,"this variation is adaptive. Under the neutral evolutionary theory, subtle phenotypes are almost neutral with little adaptive value. To test this idea, we studied the infraspecific variation in flower shape and color in Mammillaria haageana, a species with a wide geographical distribution and phenotypic variation, which populations are often recognized as infraspecific taxa. RESULTS: We collected samples from wild populations, kept them in the greenhouse f",unreviewed
A,166,Monarda fistulosa,Lamiaceae,1,30,30,1,1,High-throughput iNaturalist image analysis reveals flower color divergence in Monarda fistulosa,10.1101/2025.05.21.655392,https://openalex.org/W4410761732,"espread species is a fundamental goal of natural history. Here we create a pipeline to analyze a large community science dataset and test hypothesized flower color divergence across the range of a widespread wildflower. Monarda fistulosa is a North American perennial that produces showy lavender inflorescences. Although previous literature suggests that the flowers of western M. fistulosa might display a deeper purple color than the eastern varieties, t",unreviewed
