priority_tier,rank,canonical_name,family,n_works,max_score,total_score,n_title_matches,n_context_matches,best_title,best_doi,best_openalex_id,best_match_evidence,review_status
B,315,Rhododendron decorum,Ericaceae,1,17,17,1,1,Drug or Toxic? A Brief Understanding of the Edible Corolla of Rhododendron decorum Franch. by Bai Nationality with Comparative Metabolomics Analysis,10.3390/metabo14090484,https://openalex.org/W4402235252,"Rhododendron is a traditional ornamental and medicinal plant in China, renowned for its aesthetic appeal and therapeutic properties. Regarding Rhododendron decorum Franch., mainly distributed in Yunnan Province, its corolla is regarded as an edible food by the Bai ethnic group in Yunnan Province. However, it is still unclear why the Bai people choose to use the Rhododendron specie",unreviewed
B,316,Rhododendron liliiflorum,Ericaceae,1,17,17,1,1,UPLC–MS/MS and Gene Expression Research to Distinguish the Colour Differences of Rhododendron liliiflorum H. Lév,10.3390/horticulturae9121351,https://openalex.org/W4389893321,"Among ornamental plants, the colour of the petals is an important feature. However, the reason for the colour differences of Rhododendron liliiflorum remains unclear. To reveal the differences in the colour of R. liliiflorum, high-efficiency liquid chromatographic collar (UPLC–MS/MS) technology was used to study the yellow and white parts of R. liliiflorum. A total o",unreviewed
B,317,Rivea ornata,Convolvulaceae,1,17,17,1,1,Trades-offs between pollinator attraction and florivore defense maximize reproductive success in the self-incompatible Rivea ornata (Convolvulaceae),10.1186/s12862-024-02301-7,https://openalex.org/W4402074833,"assessed traits related to pollinator attraction and reward, determined its mating system, identified floral visitors and effective pollinators, and investigated the effect of florivory on reproductive success. RESULTS: Rivea ornata is highly fertile but self-incompatible and an obligate outcrosser, rendering it highly dependent on pollinators. Lepidopterans, particularly nocturnal hawk moths, were found to account for a significant proportion of a",unreviewed
B,318,Rodriguezia granadensis,Orchidaceae,1,17,17,1,1,Pollination ecology of Rodriguezia granadensis (Orchidaceae),10.15517/lank.v15i2.20745,https://openalex.org/W1922006848,"En éste artículo describimos la variación fenotípica y ecología de la polinización de la epífita de ramita Rodriguezia granadensis. La especie presenta polimorfismo para el color de las flores (blanco a rosa), lo que lo llevó a hipotetizar que las diferentes formas de color pueden ser polinizadas por diferentes polinizadores. Para evaluar esta hip",unreviewed
B,319,Rubus corchorifolius,Rosaceae,1,17,17,1,1,Widely targeted metabolomics of different tissues in Rubus corchorifolius,10.1515/biol-2022-0996,https://openalex.org/W4408236537,"Abstract Rubus corchorifolius , a medicinal plant of the Rosaceae family, is known for its diverse bioactive compounds. This study employs widely targeted metabolomics to investigate the metabolic profiles of leaf, stem, and flower tissue from R. co",unreviewed
B,320,Saba senegalensis,Apocynaceae,1,17,17,1,1,Hibiscus sabdariffa anthocyan stabilization tests by co-maceration of crushed calices with powder of Saba senegalensis fruit bark and combretum Micranthum leaf,10.18488/65.v10i1.3453,https://openalex.org/W4386688545,"Tannins can interact with anthocyanins to form complexes that stabilize color and protect anthocyanins from degradation. Thus, this work proposes to study the effect of the tannins of bark of the fruit of Saba Senegalensis and Combretum Micranthum on the stability of the anthocyanins of drink based on red calyxes of hibiscus obtained by co-maceration. The anthocyanin concentration was determined by the pH-differential method. The red colo",unreviewed
B,321,Salvia przewalskii,Lamiaceae,1,17,17,1,1,Spatial variation of pollen receipt and effects of heterospecific pollen on seed set in Salvia przewalskii,10.1002/ece3.9795,https://openalex.org/W4319066457,"eproductive effects of HP receipt across geographic locations under natural conditions. We investigated the spatial variation of pollen deposition across eight sites and how the pollen receipt related to the seed set of Salvia przewalskii , a subalpine perennial herb in Hengduan Mountain in southwest China. We found that stigmatic pollen loads substantially varied among sites for several metrics, including quantities of conspecific and heterospecific pol",unreviewed
B,322,Sambucus racemosa,Viburnaceae,1,17,17,1,1,"No Effect of Selective Maturation on Fruit Traits for a Bird-Dispersed Species, Sambucus racemosa",10.3390/plants10020376,https://openalex.org/W3130107603,"es would not selectively mature fruits that contain more seeds because they are not preferred by birds. Here, we investigated the effect of selective abortion on the fruit traits of a bird-dispersed species, elderberry (Sambucus racemosa L. subsp. kamtschatica). We performed a flower-removal experiment. Half of the inflorescences on each individual tree were removed for the treatment group, whereas the control group was not manipulated. We found that th",unreviewed
B,323,Sarracenia leucophylla,Sarraceniaceae,1,17,17,1,1,"Prey Capture in Anthocyanin-free Sarracenia leucophylla (Sarraceniaceae) Is Associated with Leaf Size, But Not Red Pigmentation",10.21273/hortsci15837-21,https://openalex.org/W3197230720,"have alternate functions as protectants against thermal and oxidative damage. Our dual-year study compares the wild-type pitcher phenotype with a true-breeding anthocyanin-free mutant of the white-topped pitcher plant ( Sarracenia leucophylla Raf.). We bred full-sibling crosses of S. leucophylla carrying either the wild-type anthocyanin gene or the anthocyanin-free variant. In both experimental years, growth points were established in outdoor plots and pitch",unreviewed
B,324,Strobilanthes echinata,Acanthaceae,1,17,17,1,1,Uncorrelated variation in widespread species: species delimitation in Strobilanthes echinata Nees (Acanthaceae),10.1111/j.1095-8339.2007.00756.x,https://openalex.org/W1499523232,"that occur over a large geographical area, because specimens taken from widely separated localities may appear very distinct when considered without reference to the full range of variation. The difficulty in delimiting Strobilanthes echinata Nees (Acanthaceae) highlights the problems taxonomists face in dealing with such widespread and variable taxa. This species has the characteristics of an ochlospecies, with multiple characters varying in an uncorrelated",unreviewed
B,325,Trillium ovatum,Melanthiaceae,1,17,17,1,1,Taxonomic study of Trillium ovatum forma hibbersonii,10.14288/1.0087047,https://openalex.org/W2974357600,"erson (Holotype UBC 73131). Leonard Wiley invalidly published the taxon as Trillium hibbersonii in 1968. A review of the taxonomic status by T.M.C. Taylor and A.F. Szczawinski resulted in the publication of the taxon as Trillium ovatum forma hibbersonii (1975). The diagnosis stated this dwarf variant was part of the continuous series of intergradations of Trillium ovatum Pursh (Taylor and Szczawinski, 1975). Taylor and Szczawinski did not cite any sma",unreviewed
B,326,Vanilla pompona,Orchidaceae,1,17,17,1,1,"Variación morfológica del labelo de Vanilla pompona (Orchidaceae) en Oaxaca, México",10.22201/ib.20078706e.2019.90.2209,https://openalex.org/W2940540253,"lectas, 58 variables analizadas fueron estadísticamente significativas. El modelo explicó 81% de la variación total estudiada con los 3 primeros componentes principales. Existe variación morfológica floral del labelo en Vanilla pompona representado por 4 morfotipos en Oaxaca, resultado de la probable presión y selección por parte de los polinizadores y el ambiente, donde los complejosmontañosos posiblemente han coadyuvado como barrera geográfica.",unreviewed
B,327,Veratrum grandiflorum,Melanthiaceae,1,17,17,1,1,Variation in pollen limitation among reproductive modules points to likely resource reallocation in the alpine plant Veratrum grandiflorum,10.1002/njb.04873,https://openalex.org/W4416227221,"cross different modular levels of an individual remain rare, especially in alpine plants. Here, we estimated pollen limitation at three modular levels (i.e., flower, raceme, and whole plant) in the perennial alpine herb Veratrum grandiflorum (Maxim. Ex Baker) Loes in the eastern Himalayan Hengduan Mountains. We used fruit set and seed production as two proxies for female reproductive success. Based on seed production, we found that pollen limitation differe",unreviewed
B,328,Viola arvensis,Violaceae,1,17,17,1,1,Rapid evolution of selfing syndrome traits in Viola arvensis revealed by resurrection ecology,10.1002/ajb2.16028,https://openalex.org/W4289885371,"pollinator decline are expected to affect plant phenology and plant-pollinator interactions. This paper aims at characterizing rapid evolution of life history traits and floral traits over two decades in the wild pansy (Viola arvensis), a common weed in agrosystems. METHODS: We used a resurrection ecology approach with genotypes sampled in 1991 and 2012 from a population in Burgundy (France). The species has a mixed mating system (hereafter: mixed se",unreviewed
B,329,Achillea millefolium,Asteraceae,1,15,15,1,0,"Comparative Phytoprofiling of Achillea millefolium Morphotypes: Assessing Antioxidant Activity, Phenolic and Triterpenic Compounds Variation across Different Plant Parts",10.3390/plants13071043,https://openalex.org/W4394566718,"Comparative Phytoprofiling of Achillea millefolium Morphotypes: Assessing Antioxidant Activity, Phenolic and Triterpenic Compounds Variation across Different Plant Parts",unreviewed
B,330,Arabidopsis halleri,Brassicaceae,1,15,15,1,0,Associational anti-herbivore defense in the trichome dimorphism of Arabidopsis halleri subsp. gemmifera (Brassicaceae),10.14989/doctor.k19536,https://openalex.org/W2473595828,Associational anti-herbivore defense in the trichome dimorphism of Arabidopsis halleri subsp. gemmifera (Brassicaceae),unreviewed
B,331,Aratitiyopea lopezii,Xyridaceae,1,15,15,1,0,Inflorescence Architecture and Floral Morphology of Aratitiyopea lopezii (Xyridaceae),10.5642/aliso.20072301.17,https://openalex.org/W1992981281,Inflorescence Architecture and Floral Morphology of Aratitiyopea lopezii (Xyridaceae),unreviewed
B,332,Arisaema triphyllum,Araceae,1,15,15,1,0,Leveraging Historic Collections: Investigating Morphometric Differentiation in Members of the Arisaema triphyllum (L.) Schott (Araceae) Species Complex,,https://openalex.org/W7167301975,Leveraging Historic Collections: Investigating Morphometric Differentiation in Members of the Arisaema triphyllum (L.) Schott (Araceae) Species Complex,unreviewed
B,333,Clarkia dudleyana,Onagraceae,1,15,15,1,0,POPULATION STRUCTURE OF MORPHOLOGICAL TRAITS IN CLARKIA DUDLEYANA . II. CONSTANCY OF WITHIN‐POPULATION GENETIC VARIANCE,10.1111/j.1558-5646.1997.tb05102.x,https://openalex.org/W2334742796,POPULATION STRUCTURE OF MORPHOLOGICAL TRAITS IN CLARKIA DUDLEYANA . II. CONSTANCY OF WITHIN‐POPULATION GENETIC VARIANCE,unreviewed
B,334,Dactylorhiza incarnata,Orchidaceae,1,15,15,1,0,Apochromic populations of Dactylorhiza incarnata s.l. (Orchidaceae): diversity and systematic significance as revealed by allozyme markers and morphology,10.1111/j.1095-8339.2009.00954.x,https://openalex.org/W2141796744,Apochromic populations of Dactylorhiza incarnata s.l. (Orchidaceae): diversity and systematic significance as revealed by allozyme markers and morphology,unreviewed
B,335,Echinacea purpurea,Asteraceae,1,15,15,1,0,Morphological characteristics and flavonoid accumulation of Echinacea purpurea cultivated at various salinity,10.13057/biodiv/d220915,https://openalex.org/W3197839747,Morphological characteristics and flavonoid accumulation of Echinacea purpurea cultivated at various salinity,unreviewed
B,336,Epimedium diphyllum,Berberidaceae,1,15,15,1,0,Quantitative morphological analysis of populations in a hybrid zone of Epimedium diphyllum and E. sempervirens var. rugosum (Berberidaceae),10.5091/plecevo.2012.637,https://openalex.org/W2062133694,Quantitative morphological analysis of populations in a hybrid zone of Epimedium diphyllum and E. sempervirens var. rugosum (Berberidaceae),unreviewed
B,337,Lathyrus linifolius,Fabaceae,1,15,15,1,0,"Towards a characterisation of the wild legume bitter vetch ( Lathyrus linifolius L. (Reichard) Bässler): heteromorphic seed germination, root nodule structure and N‐fixing rhizobial symbionts",10.1111/plb.12902,https://openalex.org/W2887500667,"Towards a characterisation of the wild legume bitter vetch ( Lathyrus linifolius L. (Reichard) Bässler): heteromorphic seed germination, root nodule structure and N‐fixing rhizobial symbionts",unreviewed
B,338,Lilium distichum,Liliaceae,1,15,15,1,0,Morphological characterization under different ecological habitats and physical mapping of 5S and 45S rDNA in Lilium distichum with fluorescence in situ hybridization,10.1186/s40693-015-0037-3,https://openalex.org/W2075237503,Morphological characterization under different ecological habitats and physical mapping of 5S and 45S rDNA in Lilium distichum with fluorescence in situ hybridization,unreviewed
B,339,Pediocactus peeblesianus,Cactaceae,1,15,15,1,0,Reassessment of subspecific taxa within Pediocactus peeblesianus (Cactaceae) by multivariate analysis of morphological characters,10.17348/jbrit.v16.i1.1234,https://openalex.org/W4286235697,Reassessment of subspecific taxa within Pediocactus peeblesianus (Cactaceae) by multivariate analysis of morphological characters,unreviewed
B,340,Pulsatilla tongkangensis,Ranunculaceae,1,15,15,1,0,"Characterization and Identification of Pulsatilla koreana and Pulsatilla tongkangensis Seedlings Based on Morphology, Colorimetric Data, and Molecular Markers",10.1002/nzc2.70095,https://openalex.org/W7128487517,"Characterization and Identification of Pulsatilla koreana and Pulsatilla tongkangensis Seedlings Based on Morphology, Colorimetric Data, and Molecular Markers",unreviewed
B,341,Rosa graciliflora,Rosaceae,1,15,15,1,0,"Integrating morphology, ecology, and genomics: Unraveling the population genetic and evolution within the Rosa graciliflora complex",10.1016/j.ympev.2025.108382,https://openalex.org/W4410979927,"Integrating morphology, ecology, and genomics: Unraveling the population genetic and evolution within the Rosa graciliflora complex",unreviewed
B,342,Sonchus oleraceus,Asteraceae,1,15,15,1,0,Using karyotyping and achene morphology to accurately identify Sonchus oleraceus (Asteraceae) in the context of its biological control,10.1101/2020.02.26.965863,https://openalex.org/W3007829185,Using karyotyping and achene morphology to accurately identify Sonchus oleraceus (Asteraceae) in the context of its biological control,unreviewed
B,343,Viola sieheana,Violaceae,1,15,15,1,0,"Species delimitation in the Ponto-Caucasian Viola sieheana complex, based on evidence from allozymes, morphology, ploidy levels, and crossing experiments",10.1007/s00606-010-0377-z,https://openalex.org/W1989317154,"Species delimitation in the Ponto-Caucasian Viola sieheana complex, based on evidence from allozymes, morphology, ploidy levels, and crossing experiments",unreviewed
B,344,Prunus serrulata,Rosaceae,1,14,14,1,1,Integrated Metabolomics and Transcriptome Analysis of Anthocyanin Biosynthetic Pathway in Prunus serrulata,10.3390/plants14010114,https://openalex.org/W4406034473,"Prunus serrulata is an important landscape tree species whose flower color has high ornamental value. However, the molecular mechanisms regulating flower color in P. serrulata remain unclear. By studying the metabolomics and transcripto",unreviewed
B,345,Adenium obesum,Apocynaceae,2,13,25,1,1,Genetic inheritance and selection in desert rose progenies,,https://openalex.org/W7119330886,"The ornamental plant market thrives on novelty and, to meet demand, breeders seek new cultivars with floral attributes of color and shape that increase ornamental value. Adenium obesum, popularly known as desert rose, is a prominent plant in the recent floricultural scene. Understanding the genetic mechanism of development of morphological characters can contribute to screening parents and selection o",unreviewed
B,346,Penstemon digitalis,Plantaginaceae,2,13,25,1,1,"Understanding Natural Selection On Floral Traits: Variation, Agents And Consequences",,https://openalex.org/W937187466,"ng series of studies examines multiple aspects of natural selection on plants with a focus on floral characters. The first paper asks whether natural selection is more variable in space or time for both a focal species (Penstemon digitalis) and for in plants in general. Indeed, selection is variable, but not more so in either of these dimensions, suggesting that constraints to local adaptation and speciation are equally as likely as their occurrence. Know",unreviewed
B,347,Coffea liberica,Rubiaceae,1,13,13,1,0,Genome-wide DNA polymorphisms in two peatland adapted Coffea liberica varieties,10.1186/s12863-025-01305-6,https://openalex.org/W4407572752,Genome-wide DNA polymorphisms in two peatland adapted Coffea liberica varieties,unreviewed
B,348,Dianthus caryophyllus,Caryophyllaceae,2,12,22,1,1,Evaluasi Keragaan Morfologi Sembilan Klon Hasil Persilangan Anyelir (Dianthus caryophyllus L.),10.29244/jhi.12.3.191-197,https://openalex.org/W4387272610,Evaluasi Keragaan Morfologi Sembilan Klon Hasil Persilangan Anyelir (Dianthus caryophyllus L.),unreviewed
B,349,Rubus spectabilis,Rosaceae,2,12,22,1,1,Spawning salmon density influences fruit production of salmonberry ( Rubus spectabilis ),10.1002/ecs2.3282,https://openalex.org/W3095261471,Spawning salmon density influences fruit production of salmonberry ( Rubus spectabilis ),unreviewed
B,350,Solanum tuberosum,Solanaceae,2,12,22,1,1,114 In Vitro Multiplication of Potato (Solanum tuberosum L.) as Affected by the Microcutting Characteristics,10.21273/hortsci.34.3.461b,https://openalex.org/W1660971466,114 In Vitro Multiplication of Potato (Solanum tuberosum L.) as Affected by the Microcutting Characteristics,unreviewed
B,351,Delphinium occidentale,Ranunculaceae,2,12,20,1,1,Pollination Ecology and Breeding System of Delphinium Occidentale,10.13001/uwnpsrc.1993.3155,https://openalex.org/W814389185,Pollination Ecology and Breeding System of Delphinium Occidentale,unreviewed
B,352,Abronia umbellata,Nyctaginaceae,1,12,12,1,0,"Moth pollination, low seed set, and vestigialization of attractive floral traits in Abronia umbellata (Nyctaginaceae)",,https://openalex.org/W2555360297,"Moth pollination, low seed set, and vestigialization of attractive floral traits in Abronia umbellata (Nyctaginaceae)",unreviewed
B,353,Acer saccharum,Sapindaceae,1,12,12,1,0,Spatial genetic structure within three sugar maple (Acer saccharum Marsh.) stands,10.1038/hdy.1991.17,https://openalex.org/W2091418049,Spatial genetic structure within three sugar maple (Acer saccharum Marsh.) stands,unreviewed
B,354,Aiphanes graminifolia,Arecaceae,1,12,12,1,0,Vegetative and reproductive phenology of the palm aiphanes graminifolia (arecaceae: arecoideae)*,,https://openalex.org/W7133366079,Vegetative and reproductive phenology of the palm aiphanes graminifolia (arecaceae: arecoideae)*,unreviewed
B,355,Alcantarea geniculata,Bromeliaceae,1,12,12,1,0,"Population differentiation and species cohesion in two closely related plants adapted to neotropical high‐altitude ‘inselbergs’, Alcantarea imperialis and Alcantarea geniculata (Bromeliaceae)",10.1111/j.1365-294x.2007.03272.x,https://openalex.org/W2132012303,"Population differentiation and species cohesion in two closely related plants adapted to neotropical high‐altitude ‘inselbergs’, Alcantarea imperialis and Alcantarea geniculata (Bromeliaceae)",unreviewed
B,356,Allium fimbriatum,Amaryllidaceae,1,12,12,1,0,A Revision of the Allium Fimbriatum (Alliaceae) Complex,10.5642/aliso.19921303.02,https://openalex.org/W2486157491,A Revision of the Allium Fimbriatum (Alliaceae) Complex,unreviewed
B,357,Alnus maritima,Betulaceae,1,12,12,1,0,106 Propagation of Alnus maritima from Softwood Cuttings,10.21273/hortsci.34.3.459e,https://openalex.org/W2141382457,106 Propagation of Alnus maritima from Softwood Cuttings,unreviewed
B,358,Anemone davidii,Ranunculaceae,1,12,12,1,0,Population Structure and Prediction of Potential Suitable Areas of Anemone davidii Franch. (Ranunculaceae) from Southwestern China,10.3390/f17020207,https://openalex.org/W7127612203,Population Structure and Prediction of Potential Suitable Areas of Anemone davidii Franch. (Ranunculaceae) from Southwestern China,unreviewed
B,359,Anemone multifida,Ranunculaceae,1,12,12,1,0,Natural Selection and Neutral Evolution Jointly Drive Population Divergence between Alpine and Lowland Ecotypes of the Allopolyploid Plant Anemone multifida (Ranunculaceae),10.1371/journal.pone.0068889,https://openalex.org/W2026854783,Natural Selection and Neutral Evolution Jointly Drive Population Divergence between Alpine and Lowland Ecotypes of the Allopolyploid Plant Anemone multifida (Ranunculaceae),unreviewed
B,360,Apoballis mutata,Araceae,1,12,12,1,0,Specialized fly pollination in Apoballis mutata (Araceae): high reproductive success in the absence of a trap system,10.5091/plecevo.169286,https://openalex.org/W7159000266,Specialized fly pollination in Apoballis mutata (Araceae): high reproductive success in the absence of a trap system,unreviewed
B,361,Aquilegia canadensis,Ranunculaceae,1,12,12,1,0,Lack of spatial structure for phenotypic and genetic variation despite high self-fertilization in Aquilegia canadensis (Ranunculaceae),10.1038/s41437-018-0065-2,https://openalex.org/W2794417209,Lack of spatial structure for phenotypic and genetic variation despite high self-fertilization in Aquilegia canadensis (Ranunculaceae),unreviewed
B,362,Arbutus unedo,Ericaceae,1,12,12,1,0,"Change in fruit properties, bioactive contents and individual phenolics of strawberry tree (Arbutus Unedo L.) fruits at different developmental stage",10.1007/s00217-026-05085-w,https://openalex.org/W7130414742,"Change in fruit properties, bioactive contents and individual phenolics of strawberry tree (Arbutus Unedo L.) fruits at different developmental stage",unreviewed
B,363,Argyreia mekongensis,Convolvulaceae,1,12,12,1,0,Near extinct Argyreia versicolor and rare Argyreia mekongensis are dependent on carpenter bee pollinators,10.1093/aobpla/plae001,https://openalex.org/W4390974280,Near extinct Argyreia versicolor and rare Argyreia mekongensis are dependent on carpenter bee pollinators,unreviewed
B,364,Argyreia versicolor,Convolvulaceae,1,12,12,1,0,Near extinct Argyreia versicolor and rare Argyreia mekongensis are dependent on carpenter bee pollinators,10.1093/aobpla/plae001,https://openalex.org/W4390974280,Near extinct Argyreia versicolor and rare Argyreia mekongensis are dependent on carpenter bee pollinators,unreviewed
B,365,Arisaema stewardsonii,Araceae,1,12,12,1,0,"First published records of Swamp Jack-in-the-pulpit, Arisaema stewardsonii Britton (Araceae), in Ontario",10.56222/28166531.2024.25,https://openalex.org/W4393224696,"First published records of Swamp Jack-in-the-pulpit, Arisaema stewardsonii Britton (Araceae), in Ontario",unreviewed
B,366,Aristolochia manshuriensis,Aristolochiaceae,1,12,12,1,0,Poor fruit set due to lack of pollinators in Aristolochia manshuriensis (Aristolochiaceae),10.5091/plecevo.2021.1747,https://openalex.org/W3136339521,Poor fruit set due to lack of pollinators in Aristolochia manshuriensis (Aristolochiaceae),unreviewed
B,367,Asimina triloba,Annonaceae,1,12,12,1,0,156 Dissemination via the Internet of Information on Pawpaw (Asimina triloba): A New Potential Tree Fruit Crop,10.21273/hortsci.34.3.469a,https://openalex.org/W2580800460,156 Dissemination via the Internet of Information on Pawpaw (Asimina triloba): A New Potential Tree Fruit Crop,unreviewed
B,368,Asphodelus ramosus,Asphodelaceae,1,12,12,1,0,Occurrence of secondary metabolites in tepals of Asphodelus ramosus L.,10.1080/11263504.2013.790851,https://openalex.org/W2058887589,Occurrence of secondary metabolites in tepals of Asphodelus ramosus L.,unreviewed
B,369,Astragalus mongholicus,Fabaceae,1,12,12,1,0,Chemical Discrimination of Astragalus mongholicus and Astragalus membranaceus Based on Metabolomics Using UHPLC-ESI-Q-TOF-MS/MS Approach,10.3390/molecules24224064,https://openalex.org/W2983826849,Chemical Discrimination of Astragalus mongholicus and Astragalus membranaceus Based on Metabolomics Using UHPLC-ESI-Q-TOF-MS/MS Approach,unreviewed
B,370,Avena fatua,Poaceae,1,12,12,1,0,Application of artificial neural networks to classify Avena fatua and Avena sterilis based on seed traits: insights from European Avena populations primarily from the Balkan Region,10.1186/s12870-024-05266-3,https://openalex.org/W4399593593,Application of artificial neural networks to classify Avena fatua and Avena sterilis based on seed traits: insights from European Avena populations primarily from the Balkan Region,unreviewed
B,371,Avena sterilis,Poaceae,1,12,12,1,0,Application of artificial neural networks to classify Avena fatua and Avena sterilis based on seed traits: insights from European Avena populations primarily from the Balkan Region,10.1186/s12870-024-05266-3,https://openalex.org/W4399593593,Application of artificial neural networks to classify Avena fatua and Avena sterilis based on seed traits: insights from European Avena populations primarily from the Balkan Region,unreviewed
