priority_tier,rank,canonical_name,family,n_works,max_score,total_score,n_title_matches,n_context_matches,best_title,best_doi,best_openalex_id,best_match_evidence,review_status
A,1,Ipomoea purpurea,Convolvulaceae,24,39,675,19,21,FREQUENCY‐DEPENDENT VARIATION FOR OUTCROSSING RATE AMONG FLOWER‐COLOR MORPHS OF IPOMOEA PURPUREA,10.1111/j.1558-5646.1987.tb02468.x,https://openalex.org/W2316750284,"In a series of previous studies, it has been shown that populations of the common morning glory Ipomoea purpurea are typically polymorphic for flower-color genes that bias pollinator service and, hence, the rate of outcrossing. In this study, we show that the rate of outcrossing for the white flower-color morph depends on its freq",unreviewed
A,2,Raphanus sativus,Brassicaceae,22,39,454,17,11,REPRODUCTIVE BIOLOGY OF PETAL COLOR VARIANTS IN WILD POPULATIONS OF RAPHANUS SATIVUS: I. POLLINATOR RESPONSE TO COLOR MORPHS,10.1002/j.1537-2197.1987.tb08595.x,https://openalex.org/W2031071577,"Pollinator response to petal color polymorphism in wild radish (Raphanus sativus) was investigated. Behavior of insect visitors was observed within experimental flower arrays, each containing two of the petal color forms seen intermixed in California populations: white, yellow, pink, and bronze. Hon",unreviewed
A,3,Gentiana lutea,Gentianaceae,23,30,497,15,22,Differences in pollination success between local and foreign flower color phenotypes: a translocation experiment with Gentiana lutea (Gentianaceae),10.7717/peerj.2882,https://openalex.org/W2474042264,Background The adaptive maintenance of flower color variation is frequently attributed to pollinators partly because they preferentially visit certain flower phenotypes. We tested whether Gentiana lutea —which shows a flower color variation (from orange to yellow) in the Cantabrian Mountains range (north of Spain)—is locally adapted to the pollinator community. Methods We transplanted orange-flowering individuals to a,unreviewed
A,4,Dactylorhiza sambucina,Orchidaceae,16,39,362,12,7,"Monitoring of Dactylorhiza sambucina (L.) Soó (Orchidaceae)—Variation in Flowering, Flower Colour Morph Frequencies, and Erratic Population Census Trends",10.3390/d15020179,https://openalex.org/W4318475531,"Central questions of reproductive research on Dactylorhiza sambucina (Orchidaceae) are, if and how pollinator-mediated negative frequency dependent selection might maintain its flower colour polymorphism. As this hypothesis was based on artificial populations, it needs to be verified und",unreviewed
A,5,Antirrhinum majus,Plantaginaceae,23,34,364,12,16,The role of pollinator-mediated selection in the maintenance of a flower color polymorphism in an Antirrhinum majus hybrid zone,10.15479/at:ista:th_526,https://openalex.org/W2954960215,"been tested by selection. This provides an excellent opportunity to test the effect of mo- lecular variation on fitness, and how this variation is able to spread through populations in a natural context. The snapdragon Antirrhinum majus is polymorphic in the wild for two loci controlling the distribution of yellow and magenta floral pigments. Where the yellow A. m. striatum and the magenta A. m. pseudomajus meet along a valley in the Spanish Pyren- ees",unreviewed
A,6,Lysimachia arvensis,Primulaceae,11,39,300,10,9,Flower colour segregation and flower discrimination under the bee vision model in the polymorphic Lysimachia arvensis,10.6084/m9.figshare.9848495,https://openalex.org/W4394516990,"Floral colour determines pollinator behaviour, strongly affecting plant-mating systems. Lysimachia arvensis has blue- and red-flowered plants and colour inheritance remains largely unknown. A control of floral colour based on one locus, with the red allele as dominant, has been proposed. This proposal cannot explain the spora",unreviewed
A,7,Raphanus raphanistrum,Brassicaceae,11,39,248,10,8,"Effects of pollinator preference on flower color polymorphism in wild radish, Raphanus raphanistrum (Brassicaceae).",,https://openalex.org/W163160015,"morphisms in plant populations. Pollinators may prefer one color morph to another, increasing its relative reproductive success, or they may remain constant to either morph, effecting assortative mating. In wild radish, Raphanus raphanistrum, these behaviors affect not only the frequencies of flower color traits, but also the persistence of crop genes in wild populations, as white-flowered plants in predominantly yellow-flowered populations may indicate pas",unreviewed
A,8,Lantana camara,Verbenaceae,12,33,206,10,6,Variations in floral secondary metabolites of three flower color morphs of Lantana camara L.: possible roles in pollinators attraction,10.1007/s44372-024-00072-5,https://openalex.org/W4405656258,Plant secondary metabolites in the flowers mediate their interactions with pollinators. We analyzed the variations in the floral secondary metabolites (FSMs) of three different flower color morphs (FCMs) of Lantana camara in relation to pollinator attraction. FSMs were characterized by GC–MS. Data analysis revealed no significant quantitative differences between the FCMs in the chemical classes and insect semiochemicals of the FSMs. The,unreviewed
A,9,Iris pumila,Iridaceae,11,30,183,10,4,Phenotypic Selection on Flower Traits in Food-Deceptive Plant Iris pumila L.: The Role of Pollinators,10.3390/sym15061149,https://openalex.org/W4378378637,"To gain insight into the evolution of flower traits in the generalized food-deceptive plant Iris pumila, we assessed the color, size, shape, and fluctuating asymmetry (FA) of three functionally distinct floral organs—outer perianths (‘falls’), inner perianths (‘standards’), and style branches—and estimated pollinator-medi",unreviewed
A,10,Anemone coronaria,Ranunculaceae,8,39,260,8,5,Distribution under climate change of Anemone coronaria : linking flower colour and seed dispersal,10.1002/njb.05105,https://openalex.org/W7160547221,"Flower colour polymorphism is driven by divergent selection regimes on the colour morphs across time and space. Anemone coronaria , a colour‐polymorphic geophyte with red, purple, and white flowers, displays a geographic pattern along Israel's aridity gradient: polymorphic populations are restricted to Mediterranean climates, while monomorphic‐red",unreviewed
A,11,Hesperis matronalis,Brassicaceae,8,39,219,8,5,The Impact of Biochemistry vs. Population Membership on Floral Scent Profiles in Colour Polymorphic Hesperis matronalis,10.1093/aob/mcn181,https://openalex.org/W2160805784,"the relative effects of shared biochemistry and/or localized population-level phenomena on floral scent phenotype, floral scent composition and emission rate were examined in five wild populations of colour polymorphic Hesperis matronalis (Brassicaceae). METHODS: Floral scent was collected by in situ dynamic headspace extraction on purple and white colour morphs in each of five wild populations. Gas chromatography-mass spectroscopy of extracts allowed de",unreviewed
A,12,Digitalis purpurea,Plantaginaceae,7,30,179,7,4,Flower color variation in Digitalis purpurea,10.6084/m9.figshare.29095451.v1,https://openalex.org/W7130406677,In this study we evaluated the effects of biotic (pollinators) and abiotic (soil nutrients) on flower color variation of Digitalis purpurea in three native populations from Sweden and two introduced populations from Bolivia.,unreviewed
A,13,Brassica rapa,Brassicaceae,9,30,155,7,4,Fine mapping and candidate gene analysis of the white flower gene Brwf in Chinese cabbage (Brassica rapa L.),10.1038/s41598-020-63165-7,https://openalex.org/W3015969351,"Abstract Flower color can be applied to landscaping and identification of the purity of seeds in hybrid production. However, the molecular basis of white flower trait remains largely unknown in Brassica rapa . In this study, an F 2 population was constructed from the cross between 15S1040 (white flower) and 92S105 (yellow flower) for fine mapping of white flower genes in B . rapa . Genetic analysis indicated that white flow",unreviewed
A,14,Lonicera japonica,Caprifoliaceae,7,22,107,7,2,Integrated metabolic profiling and transcriptome analysis of pigment accumulation in Lonicera japonica flower petals during colour-transition,10.1186/s12870-021-02877-y,https://openalex.org/W3113869398,"BACKGROUND: Plants have remarkable diversity in petal colour through the biosynthesis and accumulation of various pigments. To better understand the mechanisms regulating petal pigmentation in Lonicera japonica, we used multiple approaches to investigate the changes in carotenoids, anthocyanins, endogenous hormones and gene expression dynamics during petal colour transitions, i.e., green bud petals (GB_Pe), white flower petals",unreviewed
A,15,Phlox drummondii,Polemoniaceae,8,30,181,6,7,MOLECULAR SIGNATURES OF SELECTION ON REPRODUCTIVE CHARACTER DISPLACEMENT OF FLOWER COLOR IN PHLOX DRUMMONDII,10.1111/j.1558-5646.2011.01452.x,https://openalex.org/W1519665771,"s been observed in a wide variety of plants and animals. A classic example of reproductive character displacement, presumed to be caused by reinforcing selection, is flower-color variation in the native Texas wildflower Phlox drummondii. Here, we use population genetic analyses to investigate molecular signatures of selection on flower-color variation in this species. First, we quantify patterns of neutral genetic variation across the range of P. drumm",unreviewed
A,16,Iris lutescens,Iridaceae,7,39,229,5,5,Neutral processes contribute to patterns of spatial variation for flower colour in the Mediterranean Iris lutescens (Iridaceae),10.1093/aob/mcw036,https://openalex.org/W2339618223,". natural selection in population differentiation. However, current explanations for the maintenance of flower colour polymorphism mainly rely on balancing selection, while neutral processes have seldom been championed. Iris lutescens (Iridaceae) is a widespread species in the northern Mediterranean basin, which shows a stable and striking purple-yellow flower colour polymorphism. To evaluate the roles of neutral processes in the spatial variation fo",unreviewed
A,17,Silene littorea,Caryophyllaceae,7,39,158,5,6,"The effects of pollination, herbivory and autonomous selfing on the maintenance of flower colour variation in Silene littorea",10.1111/plb.13209,https://openalex.org/W3103775414,"Intraspecific flower colour variation has been generally proposed to evolve as a result of selection driven by biotic or abiotic agents. In a polymorphic population of Silene littorea with pink- and white-flowered plants, we studied pollinators, analysed flower colour perception and tested for differences in pollinator visitation. We also experimentally analysed pollinator limitation in fruit and see",unreviewed
A,18,Medicago sativa,Fabaceae,5,39,108,5,2,Adaptive Mechanisms of White-Flowered Alfalfa (Medicago sativa L.) in High-Altitude Cold and Saline–Alkali Environments,10.3390/biology15050414,https://openalex.org/W7133356404,"White-flowered alfalfa (Medicago sativa L.) persisting in Qinghai–Tibet Plateau’s saline–alkali habitats provides a unique model to explore floral color polymorphism-linked ecological adaptation. We systematically compared phenotypic, physiological, transcrip",unreviewed
A,19,Lotus corniculatus,Fabaceae,5,39,93,5,1,THE KEEL PETAL COLOUR POLYMORPHISM OF LOTUS CORNICULATUS L. IN SCOTLAND,10.1111/j.1469-8137.1981.tb04098.x,https://openalex.org/W2166044192,"SUMMARY In a survey of the keel petal colour polymorphism in Lotus corniculatus L. conducted at 61 coastal and inland locations in Scotland, there was a major difference in morph frequency between populations in the west and those in the east and central areas, with the dark keel being at low‐relat",unreviewed
A,20,Rhododendron simsii,Ericaceae,5,30,127,5,4,How to perform RT-qPCR accurately in plant species? A case study on flower colour gene expression in an azalea (Rhododendron simsii hybrids) mapping population,10.1186/1471-2199-14-13,https://openalex.org/W2130784523,"BACKGROUND: Flower colour variation is one of the most crucial selection criteria in the breeding of a flowering pot plant, as is also the case for azalea (Rhododendron simsii hybrids). Flavonoid biosynthesis was studied intensively in several species. In azalea, flower colour can be described by means of a 3-gene model. However, this model does not clarify pink-coloration. The last decade ge",unreviewed
A,21,Brassica napus,Brassicaceae,6,30,107,5,3,The Role of Carotenoid Cleavage Dioxygenase 4 in Flower Color of the Allopolyploid Brassica napus,10.15368/theses.2014.133,https://openalex.org/W413623964,"ing to variable phenotypic traits noted in newly formed allopolyploids. To better understand these mechanisms in the context of molecular biology, evolution, and plant breeding, plant biologists study the model organism Brassica napus (farmed as canola or oilseed rape). With white-flowering and yellow-flowering progenitors, flower color phenotype of B. napus presents an opportunity to examine subgenomic interactions. CAROTENOID CLEAVAGE DIOXYGENASE 4",unreviewed
A,22,Lobelia siphilitica,Campanulaceae,5,30,96,5,4,"Pollinators, Herbivores, and the Maintenance of Flower Color Variation: A Case Study with Lobelia siphilitica",10.1086/656511,https://openalex.org/W2077295153,"nd the agents of selection on flower color have rarely been estimated. We estimated selection by pollinators and a predispersal seed predator on the three fundamental components of color (brightness, chroma, and hue) of Lobelia siphilitica flowers. We compared phenotypic selection on flowers of supplemental hand- versus open-pollinated plants to infer whether pollinators were an agent of selection on color. We compared attacked and unattacked plants to in",unreviewed
A,23,Ipomopsis aggregata,Polemoniaceae,7,28,125,5,6,POLLINATION AND SEED PRODUCTION IN IPOMOPSIS AGGREGATA: DIFFERENCES AMONG AND WITHIN FLOWER COLOR MORPHS,10.1002/j.1537-2197.1988.tb14186.x,https://openalex.org/W1971610493,"The pollination of red, pink, and white color morphs of Ipomopsis aggregata was evaluated to assess whether ethological isolation based on pollinator color discrimination may occur. We observed animal visitors, assessed pollen delivery, seed set per fruit, percentage of flowers setting fruit, n",unreviewed
A,24,Phaseolus vulgaris,Fabaceae,6,18,83,5,2,075 Confirmation of Molecular Markers and Flower Color Associated with QTL for Resistance to Common Bacterial Blight in Common Beans,10.21273/hortsci.34.3.454b,https://openalex.org/W2509869537,"Common bacterial blight, incited by Xanthomonas campestris pv. phaseoli ( Xcp ), is a serious disease of common bean ( Phaseolus vulgaris ). RAPD markers and flower color ( V gene) previously had been reported to be associated with six QTL affecting leaf and pod resistance to Xcp . However, the markers for the QTL were not confirmed in different populatio",unreviewed
A,27,Anemone pavonina,Ranunculaceae,8,39,231,4,7,Data for Heinze et al. (2026): Flower colour polymorphism in the peacock anemone ( Anemone pavonina ) reflects spatiotemporal variation in pollinator abundance. Am. J. Bot.,10.6084/m9.figshare.31301656,https://openalex.org/W7148717901,"These are the raw data underlying the following publication:Heinze, J., C. J. Van der Kooi, G. Vogg, U. Jäger, and J. Spaethe. 2026. Flower colour polymorphism in the peacock anemone ( Anemone pavonina ) reflects spatiotemporal variation in pollinator abundance. American Journal of Botany. The worksheet ""Receptivity_Pollination_type"" includes all data used for the study of receptivity and cross-, geitonogamous, and au",unreviewed
A,28,Impatiens capensis,Balsaminaceae,5,20,69,4,2,MICROGEOGRAPHIC GENETIC STRUCTURE OF MORPHOLOGICAL AND LIFE HISTORY TRAITS IN A NATURAL POPULATION OF IMPATIENS CAPENSIS,10.1111/j.1558-5646.1991.tb05276.x,https://openalex.org/W2321872532,"To investigate the microgeographic spatial structure of genetic variation for quantitative traits in a natural population of Impatiens capensis, we performed a common-garden greenhouse experiment. Seedlings were collected at 10-m intervals from a 40 times 40-m permanent grid in a natural population and grown to maturity in a greenhouse. From these parents, 3 se",unreviewed
A,32,Linanthus parryae,Polemoniaceae,6,39,150,3,6,PERSPECTIVE: EVOLUTION OF FLOWER COLOR IN THE DESERT ANNUAL LINANTHUS PARRYAE: WRIGHT REVISITED,10.1111/j.0014-3820.2001.tb00650.x,https://openalex.org/W2126691403,"Linanthus parryae, a diminutive desert annual with white or blue flowers, has been the focus of a long-standing debate among evolutionary biologists. At issue is whether the flower color polymorphism in this species is the product of ran",unreviewed
A,33,Platystemon californicus,Papaveraceae,3,39,111,3,3,FLOWER COLOR POLYMORPHISM AND POLLINATION BIOLOGY OF PLATYSTEMON CALIFORNICUS BENTH. (PAPAVERACEAE),10.1002/j.1537-2197.1981.tb12383.x,https://openalex.org/W2023026998,"Five genetically controlled flower color morphs in Platystemon californicus tend to occur in distinct geographic regions, suggesting regional selection of morphs. I examined the reproductive biology of P. californicus to determine whether color morphs are subject to selection due to differences",unreviewed
A,34,Castilleja coccinea,Orobanchaceae,3,39,104,3,3,Floral bract color of Castilleja coccinea may influence seed viability,,https://openalex.org/W326681242,"Castilleja coccinea is a native annual or biennial plant with showy scarlet or yellow bracts. Although much is known about the hemi-parasitic nature of the plant, little is understood about the influence of floral color polymorphisms of Ca",unreviewed
A,35,Cirsium palustre,Asteraceae,3,39,97,3,1,The ecological genetics of flower colour variation in Cirsium palustre,10.5287/ora-mj5dwmwbx,https://openalex.org/W753206841,"The thistle Cirsium palustre exists over most of lowland Britain as a predominantly purple flowered species. However the populations of seacliffs and mountains exhibit a flower colour polymorphism, occurring as homozygous white morphs, homozygous a",unreviewed
A,36,Trillium sessile,Melanthiaceae,3,39,90,3,2,BIOCHEMICAL BASIS OF FLORAL COLOR POLYMORPHISM IN A HETEROCYANIC POPULATION OF TRILLIUM SESSILE (LILIACEAE),10.1002/j.1537-2197.1989.tb11280.x,https://openalex.org/W2007736589,"A study of flavonoids occurring within a heterocyanic population of Trillium sessile was made to determine the chemical basis of a common floral color polymorphism in this species. In the study population, three floral color phenotypes (red, pink, yellow) are determined primarily by the presence or abse",unreviewed
A,37,Prunus persica,Rosaceae,5,30,90,3,4,Two loss‐of‐function alleles of the glutathione S‐transferase ( GST ) gene cause anthocyanin deficiency in flower and fruit skin of peach ( Prunus persica ),10.1111/tpj.15312,https://openalex.org/W3157450640,"Summary Flower and fruit colors are important agronomic traits. To date, there is no forward genetic evidence that the glutathione S‐transferase ( GST ) gene is responsible for the white flower color in peach ( Prunus persica ). In this study, genetic analysis indicated that the white‐flower trait is monogenetic, is recessive to the non‐white allele, and shows pleiotropic effects with non‐white‐flowered types. The genetic locus underpinning",unreviewed
A,38,Vicia faba,Fabaceae,4,30,80,3,3,Bumblebee responses to variation in pollinator‐attracting traits of Vicia faba flowers,10.1002/ece3.10617,https://openalex.org/W4388595783,"ing sufficient crop pollination. We have identified substantial variation in flower shape, petal size, corolla‐tube length, petal spot size and floral volatile compounds among a panel of 30 genetically distinct lines of Vicia faba . Using this variation, we found that Bombus terrestris was able to distinguish between natural variation in petal spot size, floral volatile emissions and corolla‐tube length. Foragers showed some innate preference for",unreviewed
A,39,Torenia fournieri,Linderniaceae,4,30,77,3,4,Flower color modification in Torenia fournieri by genetic engineering of betacyanin pigments,10.1186/s12870-024-05284-1,https://openalex.org/W4400097771,"ineered to express betalain pigments. Betalains can also be used for flower color modification in ornamental plants, as they confer vivid colors, like red and yellow. To date, betalain engineering to modify the color of Torenia fournieri-or wishbone flower-a popular ornamental plant, has not been attempted. RESULTS: We report the production of purple-reddish-flowered torenia plants from the purple torenia cultivar ""Crown Violet."" Three betalain-biosynth",unreviewed
A,40,Mimulus ringens,Phrymaceae,4,30,62,3,2,Floral colour variation across life history and geography in Mimulus ringens (Phrymaceae),10.1093/botlinnean/boad065,https://openalex.org/W4393339809,"es that result in temporal or ecogeographic isolation. We investigate the possibility that both floral colour and life history have shifted together in a recently described, genetically distinct group within the species Mimulus ringens. Using a large, range-wide citizen science dataset, we test for geographic trends in flower colour and flowering time. We combine this with greenhouse studies in populations of known life history to test for differences",unreviewed
A,41,Platycodon grandiflorus,Campanulaceae,3,30,54,3,1,Transcriptomic and Metabolomic Analysis of the Mechanisms of the Difference in Flower Color between White and Purple Platycodon grandiflorus,10.20944/preprints202601.2317.v1,https://openalex.org/W7126220675,"mpounds C₆₃H₇₃O₃₇ and C₂₇H₁₇NO₄ show extremely significant variation (P < 0.01), while lobetyolin C₂₀H₂₈O₈ exhibited significant differences (P < 0.05). A total of 1970 DEGs were identified between white or purple Platycodon grandiflorus. Comparative transcriptomic analysis reveals differential expression of genes and transcriptional regulators involved in flower color formation between white and purple Platycodon grandiflorus flowers. The DEGs showing",unreviewed
A,42,Bixa orellana,Bixaceae,3,29,64,3,0,Floral Color Polymorphism and Reproductive Success in Annatto (Bixa orellana L.),10.1007/s12042-013-9128-y,https://openalex.org/W2089900994,Floral Color Polymorphism and Reproductive Success in Annatto (Bixa orellana L.),unreviewed
A,43,Cistus ladanifer,Cistaceae,3,29,53,3,0,Similar reproductive success of the two petal colour polymorphisms of Cistus ladanifer (Cistaceae),10.1080/11263504.2011.633111,https://openalex.org/W2131818600,Similar reproductive success of the two petal colour polymorphisms of Cistus ladanifer (Cistaceae),unreviewed
A,44,Gloriosa superba,Colchicaceae,3,28,72,3,3,Flower orientation in Gloriosa superba (Colchicaceae) promotes cross-pollination via butterfly wings,10.1093/aob/mcaa048,https://openalex.org/W3011739698,"S: Complex modifications of angiosperm flowers often function for precise pollen placement on pollinators and to promote cross-pollination. We explore the functional significance of the unusually elaborate morphology of Gloriosa superba flowers, which are divided into one hermaphrodite meranthium and five male meranthia (functional pollination units of a single flower). METHODS: We used controlled pollination experiments, floral measurements, pollen lo",unreviewed
A,45,Ipomoea hederacea,Convolvulaceae,3,26,60,3,3,"Ecological, Physiological and Molecular Population Genetics of a Single-locus Leaf Shape Cline in Ivyleaf Morning Glory, Ipomoea hederacea",,https://openalex.org/W2726746889,"shape is remarkably variable among plants, and hence likely has major consequence for ecological function and fitness. My thesis addresses the ecological significance of clinal variation for a leaf shape polymorphism in Ipomoea hederacea (lobed leaves dominate the north, entire-shaped leaves restricted to the south), and investigates the role of adaptation and demography in shaping its evolutionary history in its eastern North American range. To evaluat",unreviewed
A,46,Paeonia delavayi,Paeoniaceae,4,25,76,3,4,Study on the Diversity of Flower Color Phenotypes in Paeonia delavayi,10.3390/d18030164,https://openalex.org/W7134188524,"Paeonia delavayi displays exceptionally diverse flower colors. This study established a quantitative classification system for these colors and analyzed the relationships among pigment composition, content, and geographical distribution",unreviewed
A,47,Orychophragmus violaceus,Brassicaceae,4,25,72,3,3,Identification and characterization of the gene OvANS associated with purple flower in Orychophragmus violaceus,10.1186/s12870-025-07412-x,https://openalex.org/W4414993276,"The color of flowers plays a crucial role in ornamental plant breeding, impacting its market value significantly. Orychophragmus violaceus, a traditional ornamental flower cultivated for its early blooming in spring, often exhibits white flower variations during the breeding process, enhancing its ornamental appeal. This study systematically identified 98",unreviewed
A,48,Gustavia santanderiensis,Lecythidaceae,3,25,69,3,3,"Morphological redescription and ecological niche modelling of Gustavia santanderiensis (Lecythidaceae), with a key for the genus in the Magdalena Valley, Colombia",10.5091/plecevo.165628,https://openalex.org/W7133957166,"the ecoregions that encompass the Magdalena Valley. The model was generated using a unique set of bioclimatic variables, with their contributions and permutation importance estimated. Key results – The flower colour in Gustavia santanderiensis , previously described by Knuth and Mori as white petals, varies considerably. Surprisingly, none of the specimens cited by Mori and Prance (1979) in their monograph corresponds to G. santanderiensis . Its geographic ra",unreviewed
